{
  "$schema": "./schema.json",
  "id": "film-thalassa",
  "kind": "film-world",
  "name": "Thalassa",
  "summary": "A living ocean world whose ecosystem teaches patience.",
  "description": "A world from ARCHIVE: Worlds Within Worlds (chapter 5). It is drawn by the film's raymarching shader (worlds-within-worlds/src/worlds/50_thalassa.glsl). Opens the film studio at this chapter; a standalone interactive version is a planned adaptation (see docs/RECOMMENDATIONS.md).",
  "categories": [
    "sustainability"
  ],
  "time": {
    "era": "future",
    "label": "Chapter 5"
  },
  "place": {
    "type": "virtual",
    "name": "Thalassa",
    "fictional": true
  },
  "purposes": [
    "experience a story"
  ],
  "launch": [
    {
      "label": "Watch chapter 5",
      "href": "worlds-within-worlds/ARCHIVE_Studio.html?chapter=4"
    }
  ],
  "preview": "portal/img/film-thalassa.jpg",
  "project": "worlds-within-worlds",
  "formats": {
    "desktop": true,
    "mobile": false,
    "webxr": false,
    "video360": true,
    "video16x9": true
  },
  "status": {
    "stage": "film-only",
    "notes": "Viewable in the film studio; interactive adaptation planned."
  },
  "engine": {
    "type": "raymarch-glsl",
    "module": "worlds-within-worlds/src/worlds/50_thalassa.glsl",
    "chapter": 4
  }
}
